{
  "$schema": "../../.claude/templates/test-data-model.schema.json",
  "schema_version": "1.0",
  "domain_slug": "loy",
  "generated": "2026-09-28",
  "metadata": {
    "scope": "The data states the loy mind map's mission behaviours require. Every row points at an EXISTING seeder and @td() alias — nothing here is seeded by a new mechanism.",
    "mind_map": ".claude/knowledge/domain/loyalty-missions.mind-map.json",
    "ticket": "VCST-6090",
    "known_limit": "One requirement stands for a per-case family: data.loy.customer.fresh-account names MSN_E2E_USER_001 as its representative alias; each 083d case binds its own MSN_E2E_USER_<case> account of the same shape."
  },
  "requirements": [
    {
      "id": "data.loy.store.missions-enabled",
      "entity": "Store",
      "purpose": "The store has loyalty and missions switched on — the ambient state every mission behaviour reads.",
      "required_state": { "Loyalty.Enable": true, "Loyalty.Missions.Enable": true },
      "lifecycle": "STATIC",
      "acquisition": { "strategy": "EXISTING" },
      "td_alias": "MSN_STORE_SETTINGS.missions_enabled",
      "cleanup": { "required": false },
      "status": "CONFIRMED",
      "evidence": [{ "class": "OBSERVED", "ref": "domain-map:loy@rev3 §1 links 1, 1b", "date": "2026-09-18" }]
    },
    {
      "id": "data.loy.store.missions-disabled",
      "entity": "Store",
      "purpose": "The same store with only the missions switch turned off.",
      "required_state": { "Loyalty.Missions.Enable": false },
      "relationships": [{ "requirement": "data.loy.store.missions-enabled", "required": true, "note": "flipped FROM the enabled baseline" }],
      "lifecycle": "STEP",
      "acquisition": {
        "strategy": "TRANSITION",
        "executor": "case",
        "from_state": { "Loyalty.Missions.Enable": true },
        "transition": "store settings GET-merge-PUT of Loyalty.Missions.Enable=false, read back before the next step"
      },
      "td_alias": "MSN_STORE_SETTINGS.setting_name",
      "cleanup": { "required": true, "via": "the case's Cleanup column restores Loyalty.Missions.Enable=true" },
      "discriminates": "The switch is the ONLY difference from the enabled baseline, so an empty loyaltyMissionProgress or an unaccrued order is attributable to the gate.",
      "limits": "Store-level shared state: the flip hides missions for every concurrent run on the store — never schedule beside 083c/083d.",
      "status": "CONFIRMED",
      "evidence": [
        { "class": "DOC", "ref": "domain-map:loy@rev3 §1 link 1b", "note": "the setting is read at the write path, the read path and route registration" },
        { "class": "SPEC", "ref": "VCST-5319", "note": "C1, C2, C25" }
      ]
    },
    {
      "id": "data.loy.mission.stable-definition",
      "entity": "Mission",
      "purpose": "Long-lived missions, one per goal type, for cases that assert a mission's DEFINITION.",
      "required_state": { "status": "Published", "public": true },
      "constraints": { "goal_type": { "one_of_each": ["OrderValueGoal", "OrderCountGoal", "PerSkuGoal"] } },
      "lifecycle": "FIXTURE",
      "shared_state": "The definition is shared; its PROGRESS accumulates across runs and freezes at Completed, so no case may assert progress movement on it.",
      "acquisition": { "strategy": "CREATE", "fallback": "EXISTING" },
      "seed_capability": "seed:loyalty-missions",
      "td_alias": "MSN_ORDERCOUNT.name",
      "cleanup": { "required": false, "via": "seed:loyalty-missions:teardown" },
      "discriminates": "One mission per goal type, so the three goal types are distinguishable on one read.",
      "status": "CONFIRMED",
      "evidence": [{ "class": "DOC", "ref": "scripts/seed-data/loyalty/missions-e2e-specs.mjs", "note": "header: why the stable set exists separately from the per-run set" }]
    },
    {
      "id": "data.loy.mission.draft",
      "entity": "Mission",
      "purpose": "A Draft sibling of the Published fixtures.",
      "required_state": { "status": "Draft" },
      "lifecycle": "FIXTURE",
      "shared_state": "Publishing it is one-way (Draft → Published), so a case that publishes it consumes it for every later run.",
      "acquisition": { "strategy": "CREATE" },
      "seed_capability": "seed:loyalty-missions",
      "td_alias": "MSN_DRAFT.status",
      "cleanup": { "required": false, "via": "seed:loyalty-missions:teardown" },
      "discriminates": "Differs from the Published fixtures only in status, so publish and draft-exclusion are decidable.",
      "limits": "A publish case must mint its own Draft — this fixture only answers read-side questions repeatably.",
      "status": "CONFIRMED",
      "evidence": [{ "class": "DOC", "ref": "domain-map:loy@rev3 §1 link 2b", "note": "one-way lifecycle" }]
    },
    {
      "id": "data.loy.mission.expired",
      "entity": "Mission",
      "purpose": "A Published mission whose window has ended and that nobody has progress on.",
      "required_state": { "status": "Published", "window": "ended", "progress": "none" },
      "lifecycle": "FIXTURE",
      "shared_state": "Any order against it would create progress and change which branch it exercises.",
      "acquisition": { "strategy": "CREATE" },
      "seed_capability": "seed:loyalty-missions",
      "td_alias": "MSN_EXPIRED.window_intent",
      "cleanup": { "required": false, "via": "seed:loyalty-missions:teardown" },
      "discriminates": "Published but out of window with no prior progress — separates window exclusion from status filtering.",
      "status": "CONFIRMED",
      "evidence": [{ "class": "OBSERVED", "ref": "REG-2026-08-27-1846", "note": "MSN-008 promoted on this fixture" }]
    },
    {
      "id": "data.loy.mission.group-targeted",
      "entity": "Mission",
      "purpose": "A Published mission restricted to one customer group.",
      "required_state": { "status": "Published", "condition": "UserGroupIsCondition", "groups": ["VIP"] },
      "lifecycle": "FIXTURE",
      "shared_state": "Definition only — visibility is asserted, never progress.",
      "acquisition": { "strategy": "CREATE" },
      "seed_capability": "seed:loyalty-missions",
      "td_alias": "MSN_GROUP_VIP.condition_groups",
      "cleanup": { "required": false, "via": "seed:loyalty-missions:teardown" },
      "discriminates": "Read by a member and an outsider of the SAME group: one must see it and one must not.",
      "status": "CONFIRMED",
      "evidence": [{ "class": "OBSERVED", "ref": "REG-2026-08-27-1846", "note": "MSN-011 promoted" }]
    },
    {
      "id": "data.loy.customer.group-member",
      "entity": "Customer",
      "purpose": "An account inside the targeted group.",
      "required_state": { "groups": "includes the mission's group" },
      "lifecycle": "FIXTURE",
      "shared_state": "A long-lived account whose balance and progress drift — assert visibility only.",
      "acquisition": { "strategy": "EXISTING" },
      "td_alias": "MSN_GROUP_AUDIENCE.member_role",
      "cleanup": { "required": false },
      "discriminates": "Differs from the outsider ONLY in group membership.",
      "status": "CONFIRMED",
      "evidence": [{ "class": "OBSERVED", "ref": "domain-map:loy@rev3 §1 actors", "date": "2026-09-18" }]
    },
    {
      "id": "data.loy.customer.group-outsider",
      "entity": "Customer",
      "purpose": "An authenticated account outside the targeted group.",
      "required_state": { "groups": "excludes the mission's group" },
      "lifecycle": "FIXTURE",
      "shared_state": "A long-lived account — assert visibility only.",
      "acquisition": { "strategy": "EXISTING" },
      "td_alias": "MSN_GROUP_AUDIENCE.nonmember_role",
      "cleanup": { "required": false },
      "discriminates": "Differs from the member ONLY in group membership.",
      "status": "CONFIRMED",
      "evidence": [{ "class": "OBSERVED", "ref": "domain-map:loy@rev3 §1 actors", "date": "2026-09-18" }]
    },
    {
      "id": "data.loy.mission.private",
      "entity": "Mission",
      "purpose": "A Published mission flagged public=false.",
      "required_state": { "status": "Published", "public": false },
      "lifecycle": "FIXTURE",
      "shared_state": "Definition only.",
      "acquisition": { "strategy": "CREATE" },
      "seed_capability": "seed:loyalty-missions",
      "td_alias": "MSN_PUBLISHED_PRIVATE.public",
      "cleanup": { "required": false, "via": "seed:loyalty-missions:teardown" },
      "discriminates": "Identical to a public sibling except the flag, so the flag's effect (or its absence) is observable.",
      "status": "CONFIRMED",
      "evidence": [{ "class": "OBSERVED", "ref": "domain-map:loy@rev3 D7", "date": "2026-09-18" }]
    },
    {
      "id": "data.loy.mission.fresh-per-run",
      "entity": "Mission",
      "purpose": "A mission minted this run, so no account has progress on it.",
      "required_state": { "status": "Published", "progress": "none for every account" },
      "relationships": [{ "requirement": "data.loy.store.missions-enabled", "required": true }],
      "lifecycle": "SCENARIO",
      "acquisition": { "strategy": "CREATE" },
      "seed_capability": "seed:missions-e2e",
      "td_alias": "MSN_E2E_ORDERCOUNT.name",
      "cleanup": { "required": true, "via": "seed:missions-e2e:teardown — AGENT-TEST-MSN-E2E- prefix sweep with an age floor" },
      "discriminates": "Every account starts at 0% on it, so 'progress advances' is observable; a stable mission may already be Completed and frozen, which makes the same assertion undecidable.",
      "status": "CONFIRMED",
      "evidence": [
        { "class": "DOC", "ref": "scripts/seed-data/loyalty/missions-e2e-specs.mjs", "note": "header: THE ONE SHAPE THAT IS REPEATABLE" },
        { "class": "OBSERVED", "ref": "kb:KB-608F7C05", "note": "a mission with progress can be neither edited nor deleted — a fresh mission is the only way forward" }
      ]
    },
    {
      "id": "data.loy.mission.ordervalue-between",